{
  "id": "baemin-prototype-recipe-detail-parity",
  "title": "RECIPE_DETAIL body prototype near-100% visual parity",
  "summary": "RECIPE_DETAIL 화면의 시각적 구현을 Baemin prototype 기준 near-100% parity로 끌어올린다. 기존 RECIPE_DETAIL 정보 구조와 API/상태/권한 계약은 변경하지 않으며, skin·layout·interaction·assets/copy·state fidelity 5축의 시각 처리만 prototype에 맞춘다. Target score >= 95, authority blocker 0.",
  "project_profile": "homecook",
  "change_type": "product",
  "surface": "frontend",
  "risk": "high",
  "preset": "vertical-slice-strict",
  "goal": "Achieve near-100% visual parity between production RECIPE_DETAIL and the Baemin prototype, scoring >= 95 on the 5-axis visual verdict with 0 authority blockers. No API/DB/status/IA changes.",
  "owners": {
    "claude": "stage1,stage4",
    "codex": "stage5,stage6",
    "workers": []
  },
  "dependencies": [
    "h7-baemin-prototype-parity-direction",
    "baemin-prototype-parity-foundation",
    "baemin-prototype-home-parity",
    "baemin-style-tokens-additive",
    "baemin-style-token-values",
    "baemin-style-shared-components",
    "baemin-style-recipe-detail-retrofit"
  ],
  "docs_refs": {
    "source_of_truth": [
      "docs/workpacks/baemin-prototype-recipe-detail-parity/README.md",
      "docs/workpacks/baemin-prototype-recipe-detail-parity/acceptance.md",
      "docs/workpacks/baemin-prototype-recipe-detail-parity/automation-spec.json"
    ],
    "governing_docs": [
      "docs/workpacks/README.md",
      "docs/workpacks/h7-baemin-prototype-parity-direction/README.md",
      "docs/workpacks/baemin-prototype-parity-foundation/README.md",
      "docs/workpacks/baemin-prototype-home-parity/README.md",
      "ui/designs/evidence/baemin-prototype-parity-foundation/capture-recipe.md",
      "ui/designs/evidence/baemin-prototype-parity-foundation/fixture-route-matrix.md",
      "ui/designs/evidence/baemin-prototype-parity-foundation/visual-verdict-schema.json",
      "ui/designs/evidence/baemin-prototype-parity-foundation/token-material-mapping.md",
      "ui/designs/evidence/baemin-prototype-parity-foundation/prototype-exclusion-inventory.md",
      "ui/designs/prototypes/homecook-baemin-prototype.html",
      "ui/designs/prototypes/baemin-redesign/screens/detail.jsx",
      "ui/designs/RECIPE_DETAIL.md",
      "ui/designs/critiques/RECIPE_DETAIL-critique.md",
      "docs/화면정의서-v1.5.1.md",
      "docs/요구사항기준선-v1.6.4.md",
      "docs/engineering/slice-workflow.md",
      "docs/engineering/agent-workflow-overview.md",
      "docs/engineering/product-design-authority.md"
    ]
  },
  "workflow": {
    "plan_loop": "skipped",
    "review_loop": "required",
    "external_smokes": [],
    "execution_mode": "manual",
    "merge_policy": "manual",
    "max_fix_rounds": {
      "backend": 0,
      "frontend": 3
    }
  },
  "verification": {
    "required_checks": [
      "pnpm verify:frontend",
      "pnpm validate:workflow-v2",
      "pnpm validate:workpack",
      "git diff --check"
    ],
    "verify_commands": [
      "pnpm verify:frontend",
      "pnpm validate:workflow-v2",
      "pnpm validate:workpack",
      "git diff --check"
    ],
    "evaluator_commands": [],
    "artifact_assertions": [
      "visual-verdict-artifact",
      "authority-report",
      "capture-evidence-complete",
      "score-threshold-met",
      "no-api-db-status-change"
    ]
  },
  "status": {
    "lifecycle": "merged",
    "approval_state": "dual_approved",
    "verification_status": "passed"
  },
  "out_of_scope": [
    "RECIPE_DETAIL information architecture changes (section hierarchy, navigation flow)",
    "API endpoint, field, table, or status value additions",
    "Jua or new font dependencies",
    "Prototype-only tabs (ingredients/steps/reviews tab switcher)",
    "Prototype-only reviews section/cards",
    "Prototype-only review count badge",
    "Prototype-only star rating input",
    "DELETE /recipes/{id}/save restoration",
    "New npm dependencies",
    "Official source-of-truth document changes",
    "HOME or PLANNER_WEEK screen changes"
  ],
  "open_questions": [],
  "closeout": {
    "phase": "completed",
    "docs_projection": {
      "roadmap_lifecycle": "merged",
      "design_status": "confirmed",
      "delivery_checklist": "complete",
      "design_authority": "passed",
      "acceptance": "complete",
      "automation_spec_metadata": "synced"
    },
    "verification_projection": {
      "required_checks": "passed",
      "external_smokes": "skipped",
      "authority_reports": [
        "ui/designs/authority/RECIPE_DETAIL-parity-authority.md",
        "ui/designs/evidence/baemin-prototype-recipe-detail-parity/stage5-design-review.md",
        ".omx/artifacts/claude-delegate-baemin-prototype-recipe-detail-parity-final-authority-gate-response-20260427T204036Z.md"
      ],
      "actual_verification_refs": [
        "ui/designs/evidence/baemin-prototype-recipe-detail-parity/visual-verdict.json",
        "ui/designs/evidence/baemin-prototype-recipe-detail-parity/visual-verdict.md",
        "qa/visual/parity/baemin-prototype-recipe-detail-parity/",
        ".artifacts/qa/baemin-prototype-recipe-detail-parity/2026-04-27T20-01-14-418Z/exploratory-report.json",
        ".artifacts/qa/baemin-prototype-recipe-detail-parity/2026-04-27T20-01-14-418Z/eval-result.json"
      ]
    },
    "merge_gate_projection": {
      "current_head_sha": "pending-pr-head",
      "approval_state": "dual_approved",
      "all_checks_green": true
    },
    "recovery_summary": {
      "manual_patch_count": 1,
      "manual_handoff": false,
      "stale_lock_count": 0,
      "ci_resync_count": 2,
      "artifact_missing": false,
      "last_recovery_at": "2026-04-27T21:05:36Z"
    },
    "repair_summary": {
      "codex_repairable_count": 3,
      "claude_repairable_count": 1,
      "manual_decision_required_count": 0,
      "human_escalation_count": 0,
      "post_merge_stale_count": 0,
      "latest_reason_code": "ci_linux_visual_baseline_refresh",
      "evidence_sources": [
        "ui/designs/authority/RECIPE_DETAIL-parity-authority.md",
        "ui/designs/evidence/baemin-prototype-recipe-detail-parity/stage5-design-review.md",
        "ui/designs/evidence/baemin-prototype-recipe-detail-parity/visual-verdict.json",
        ".artifacts/qa/baemin-prototype-recipe-detail-parity/2026-04-27T20-01-14-418Z/exploratory-report.json",
        "tests/e2e/qa-visual.spec.ts-snapshots/qa-recipe-detail-desktop-chrome-linux.png",
        "tests/e2e/qa-visual.spec.ts-snapshots/qa-recipe-detail-mobile-chrome-linux.png",
        "tests/e2e/qa-visual.spec.ts-snapshots/qa-recipe-detail-mobile-ios-small-linux.png",
        "tests/e2e/qa-visual.spec.ts-snapshots/qa-login-gate-modal-desktop-chrome-linux.png"
      ]
    },
    "projection_state": {
      "docs_synced_at": "2026-04-27T20:45:42.225Z",
      "status_synced_at": "2026-04-27T20:45:42.225Z",
      "pr_body_synced_at": "pending-pr-body"
    }
  }
}
