{
  "id": "10a-shopping-detail-interact",
  "title": "Shopping detail view and check/exclude interaction",
  "summary": "장보기 상세 조회, 체크 토글, 제외/되살리기 (exclude→uncheck 규칙 포함)",
  "project_profile": "homecook",
  "change_type": "product",
  "surface": "fullstack",
  "risk": "medium",
  "preset": "vertical-slice-strict",
  "goal": "장보기 리스트 생성 후 SHOPPING_DETAIL 화면에서 사용자는 구매할 재료를 체크하고, 팬트리에 이미 있는 재료를 제외 섹션과 구매 섹션 사이에서 자유롭게 이동할 수 있다. 제외 섹션으로 이동한 재료는 자동으로 구매 체크가 해제되며(exclude→uncheck 규칙), 사용자는 장보기를 실제로 수행하면서 필요에 따라 항목을 조정할 수 있다. 완료된 장보기 리스트는 read-only 모드로 전환되어 수정할 수 없으며, 마이페이지에서 재열람 시에도 같은 read-only 상태를 유지한다.",
  "owners": {
    "claude": "stage1,stage3,stage4",
    "codex": "stage2,stage5,stage6",
    "workers": []
  },
  "dependencies": [
    "01-discovery-detail-auth",
    "02-discovery-filter",
    "03-recipe-like",
    "04-recipe-save",
    "05-planner-week-core",
    "06-recipe-to-planner",
    "07-meal-manage",
    "08a-meal-add-search-core",
    "08b-meal-add-books-pantry",
    "09-shopping-preview-create"
  ],
  "docs_refs": {
    "source_of_truth": [
      "docs/요구사항기준선-v1.6.3.md",
      "docs/화면정의서-v1.5.0.md",
      "docs/api문서-v1.2.2.md",
      "docs/db설계-v1.3.1.md"
    ],
    "governing_docs": [
      "docs/workpacks/10a-shopping-detail-interact/README.md",
      "docs/workpacks/10a-shopping-detail-interact/acceptance.md",
      "docs/workpacks/10a-shopping-detail-interact/automation-spec.json",
      "docs/engineering/slice-workflow.md",
      "docs/engineering/tdd-vitest.md",
      "docs/engineering/playwright-e2e.md",
      "docs/engineering/product-design-authority.md"
    ]
  },
  "workflow": {
    "plan_loop": "skipped",
    "review_loop": "required",
    "external_smokes": [],
    "execution_mode": "autonomous",
    "evaluator_profile": "vertical-slice-strict",
    "merge_policy": "conditional-auto",
    "max_fix_rounds": {
      "backend": 4,
      "frontend": 4
    }
  },
  "verification": {
    "required_checks": [
      "pnpm verify:backend",
      "pnpm verify:frontend",
      "pnpm lint",
      "pnpm typecheck"
    ],
    "verify_commands": [
      "pnpm verify:backend",
      "pnpm verify:frontend"
    ],
    "evaluator_commands": [],
    "artifact_assertions": [
      "playwright-report",
      "trace.zip",
      "authority-report"
    ]
  },
  "status": {
    "lifecycle": "planned",
    "approval_state": "not_started",
    "verification_status": "pending",
    "evaluation_status": "not_started",
    "evaluation_round": 0,
    "last_evaluator_result": null,
    "auto_merge_eligible": false,
    "blocked_reason_code": null
  },
  "out_of_scope": [
    "장보기 순서 변경 (드래그&드롭) — slice 11",
    "장보기 완료 처리 — slice 12a",
    "팬트리 반영 선택 팝업 — slice 12b",
    "장보기 공유 텍스트 — slice 10b",
    "장보기 기록 목록 조회 — slice 17a"
  ],
  "open_questions": []
}
